{
  "id": "toast-enter",
  "name": "Toast entrance",
  "description": "A short horizontal slide for non-blocking notifications.",
  "category": "entrance",
  "classes": "animate-initial:opacity-0 animate-initial:x-24 animate-enter:opacity-100 animate-enter:x-0 animate-duration-240 animate-ease-out",
  "accessibility": "Use an appropriate live region and provide enough time to read or dismiss the toast.",
  "adapters": ["react", "vue", "vanilla", "react-native"],
  "maintainer": "motionwind/core",
  "version": "1.0.0",
  "compatibleCore": ">=2.0.0 <3",
  "bundleImpact": "Preset only; no runtime code added.",
  "source": "https://github.com/piyushzingade/motionwind/tree/main/registry/recipes/toast-enter.json"
}
