{
  "id": "svg-line-loader",
  "name": "SVG line loader",
  "description": "Draw and repeat an SVG path for compact progress feedback.",
  "category": "loading",
  "classes": "animate-initial:path-length-0 animate-enter:path-length-1 animate-duration-900 animate-ease-in-out animate-repeat-infinite animate-repeat-reverse",
  "accessibility": "Give the SVG a status label and stop repeating when the operation completes.",
  "adapters": ["react", "vue", "vanilla"],
  "maintainer": "motionwind/core",
  "version": "1.0.0",
  "compatibleCore": ">=2.0.0 <3",
  "bundleImpact": "Preset only; no runtime code added.",
  "source": "https://github.com/piyushzingade/motionwind/tree/main/registry/recipes/svg-line-loader.json"
}
