{
  "id": "progress-bar",
  "name": "Progress bar",
  "description": "An animated width fill for a progress bar triggered on scroll into view.",
  "category": "scroll",
  "classes": "animate-initial:w-0 animate-inview:w-100pct animate-once animate-duration-800 animate-ease-out",
  "accessibility": "Use a native progress element or role='progressbar' with aria-valuenow to expose state.",
  "adapters": ["react", "vue", "vanilla"],
  "maintainer": "motionwind/core",
  "version": "1.0.0",
  "compatibleCore": ">=2.0.0 <3",
  "bundleImpact": "Preset only; no runtime code added.",
  "source": "https://github.com/piyushzingade/motionwind/tree/main/registry/recipes/progress-bar.json"
}
