{
  "id": "ripple",
  "name": "Ripple",
  "description": "A radial scale-and-fade burst that emanates from a tap point.",
  "category": "interaction",
  "classes": "animate-initial:scale-0 animate-initial:opacity-100 animate-enter:scale-400 animate-enter:opacity-0 animate-duration-500 animate-ease-out",
  "accessibility": "Use the ripple as a purely decorative effect and do not rely on it to communicate state.",
  "adapters": ["react", "vue", "vanilla"],
  "maintainer": "motionwind/core",
  "version": "1.0.0",
  "compatibleCore": ">=2.0.0 <3",
  "bundleImpact": "Preset only; no runtime code added.",
  "source": "https://github.com/piyushzingade/motionwind/tree/main/registry/recipes/ripple.json"
}
