{
  "id": "notification-stack",
  "name": "Notification stack",
  "description": "Staggered upward entrances for stacked notification cards.",
  "category": "entrance",
  "classes": "animate-initial:opacity-0 animate-initial:y--20 animate-enter:opacity-100 animate-enter:y-0 animate-stagger-80 animate-duration-260 animate-ease-back-out",
  "accessibility": "Use a live region with aria-live='polite' and provide enough time to read each notification.",
  "adapters": ["react", "vue", "vanilla", "react-native"],
  "maintainer": "motionwind/core",
  "version": "1.0.0",
  "compatibleCore": ">=2.0.0 <3",
  "bundleImpact": "Preset only; no runtime code added.",
  "source": "https://github.com/piyushzingade/motionwind/tree/main/registry/recipes/notification-stack.json"
}
