{
  "id": "skeleton-pulse",
  "name": "Skeleton pulse",
  "description": "A pulsing opacity loop for placeholder content while data loads.",
  "category": "loading",
  "classes": "animate-initial:opacity-100 animate-enter:opacity-40 animate-repeat-infinite animate-repeat-reverse animate-duration-800 animate-ease-in-out",
  "accessibility": "Announce loading state with aria-busy; remove skeleton when content arrives.",
  "adapters": ["react", "vue", "vanilla", "react-native"],
  "maintainer": "motionwind/core",
  "version": "1.0.0",
  "compatibleCore": ">=2.0.0 <3",
  "bundleImpact": "Preset only; no runtime code added.",
  "source": "https://github.com/piyushzingade/motionwind/tree/main/registry/recipes/skeleton-pulse.json"
}
